,Job Title,Salary Estimate,Job Description,Rating,Company Name,Location,Headquarters,Size,Founded,Type of ownership,Industry,Sector,Revenue,Competitors
29,Marketing Analyst,$30K - $55K (Glassdoor est.),"Why Work for Apex?
Apex has been voted one of the best mid-sized companies to work for in Texas since 2009 because we’re committed to employee empowerment, team building, and a good work/life balance. We do our best to make sure that all Apexers have the tools, knowledge, and support they need to enjoy a rewarding career with us. Comfortably nestled just off I-30 and 10 minutes west of downtown Fort Worth, we offer a long list of benefits that make us a premier work location.

Some of the highlights:
Competitive compensation plans augmented by generous profit sharing and regular salary reviews.
Multiple high quality health care plans to choose from with a short waiting period.
Dental, vision, life, short term disability and long term disability coverage.
401(k) plan with Apex matched contributions.
Tuition reimbursement for college, plus plenty of Apex managed training classes.
360⁰ feedback, leadership training, and a culture that empowers individuality.
On-site fitness facilities and gym reimbursement program.
Rewards driven wellness program with an individualized holistic approach.
Connected, friendly work environment. We celebrate our accomplishments (and birthdays).
Paid maternity and leave benefits giving the time and flexibility needed to care for yourself and/or family.
Personal Leave options for non-medical related needs.

Win or Lose as a Team


All Apexers are encouraged to collaborate in an effort to continuously improve our processes and customer service. Everyone on the team is responsible for presenting new ideas and perspectives. In addition to base salary, all employees enjoy quarterly profit sharing as a thank you for their contributions.

What We’re Looking For


We are looking for candidates that utilize strong analytical, critical-thinking, collaboration and communication skills to research markets and analyze data to provide insights to help identify opportunities for growth and efficiencies for all Apex lines of business.

This role can work from home, but candidates should be local to the greater Fort Worth, TX area, as this will transition to onsite in the future.

Opportunity to Excel


Our most successful marketing members are decisive team players who are skilled multi-taskers. The ideal candidate for the Marketing Analyst position should be a self-starter that takes the initiative to find deeper meaning and insights within data and research, with the ability to see the big picture.

Essential Duties and Responsibilities
Initiate market research strategies and procedures to identify market segments and to analyze and monitor market segments, competition, brand perception, market penetration, and market share for all Apex lines of business.
Initiate market research methods and procedures to identify opportunities for new client acquisition and to determine the feasibility of new product offerings.
Track and analyze marketing KPIs to measure the effectiveness of advertising, marketing and communications strategies.
Work collaboratively with the online marketing team to analyze keyword search data and website traffic to recommend website and campaign optimizations.
Monitor the marketing and sales funnels to track and monitor pipeline movement, as well as close and loss rates.
Monitor email campaign metrics such as delivery, subject lines, open rates and click-through rates to analyze data and recommend campaign improvements.
Analyze sales and marketing metrics to measure ROI for all online and offline marketing campaigns.
Analyze marketing budget distribution and acquisition costs.
Create, implement, and analyze annual client surveys, debtor surveys, and ad hoc surveys as requested to measure loyalty and satisfaction, as well as gain market insights.
Work collaboratively with the marketing team, department heads, business analysts and/or product owners to initiate research projects, polls or focus groups. Document, analyze and prepare reports that clearly communicate results from research initiatives or activity.
Effectively communicate analysis and insights in written, verbal, and presentation formats to peers, management, and senior management as needed. Prepare reports on findings while illustrating data with graphs and translating complex results into written texts that are clear and understandable.
Provide historical trending and analysis of client acquisition, net client growth, market penetration, sales effectiveness and efficiency of ongoing promotions and campaigns.
Regular attendance during established work schedule to fulfill other essential functions of the job.
Desired Qualifications


We are looking for excellent communicators with strong mathematical, problem solving, and analytical skills. A degree in Marketing, Business, Statistics, Data Science, or Journalism is preferable, or equivalent work experience. Candidates should have at least 3 years of marketing, product development, advertising, analytics, data science or research experience with expert-level knowledge of building and manipulating spreadsheets in Excel. Experience in the transportation, factoring, or financial services industries is preferable.

Primary Location:

US TX Fort Worth",4,"Apex Capital
3.9","Fort Worth, TX",-1,201 to 500 Employees,1995,Company - Private,Financial Transaction Processing,Finance,Unknown / Non-Applicable,-1
30,PySpark Data Engineer,$72K - $128K (Glassdoor est.),"(Remote until otherwise noted)

Overview


We are looking for a PySpark Data Engineer to join our Advanced Analytics team to work on interesting projects to help our clients make data driven solutions. As a big data engineer, you’ll work closely with the client and data scientists to understand their business needs, design, and develop a scalable data processing infrastructure. You will work closely with your team including analysts, TPMs, and data scientists to define tasks, provide estimates, and work together to deliver a world class solution. The ideal candidate will have the balance of technical skills and business acumen to help the client better understand their core needs while understanding technical limitations. The solutions you build will have a major real-world impact in enabling machine learning and data-driven decisions to improve safety, customer experience, and efficiency.

About you…
Experience partnering & communicating with executive management team to understand business needs and pain points
Ability to communicate engineering concepts to business stakeholders
Passion for building large scale machine learning pipelines
Adept at developing and iterating solutions rapidly
What we offer our consultants:

Experience working with both large enterprise clients and mid-sized clients
Progressive responsibilities that encourage ownership and design
Opportunity to learn and gain experience in complimentary skills such as meeting facilitation, data management, project management, data modeling, and data management
Company Culture that celebrates “Foster the culture of we”, “Act with integrity” and “Drive towards excellence” while having fun at work
Training and certification opportunities to support your career now and after Logic20/20
Various opportunities to give back to the community through company sponsored events
Required Qualifications
Strong understanding of high-performance ETL development with Python
5+ years of data engineering, 3+ years of PySpark
Data engineering implementation experience with some of the following technologies:
Python
Spark and PySpark
SparkSQL
Advanced engineering skills with Python
Comfortable working with very large data
Demonstrated ability to identify business and technical impacts of user requirements and incorporate them into the project schedule
Strong communication and interpersonal skills
Ability to work both independently and as part of a team
Work across team to solve technical roadblocks for our customers.
An undergraduate degree in technology or business is required
Preferred Qualifications
Experience building data and computational systems that support machine learning
Knowledge of AWS services
Experience with modern software delivery practices, including source control, testing, continuous delivery
Experience delivering product with Agile methodologies
Experience with streaming data in Spark
About Logic20/20. . .

We hire remarkable people to create simple, efficient solutions for complex problems.

Although we make it look like magic, our success is due to our approach (methodical and structured) and the people we hire (smart, motivated, and team oriented). Together, these enable us to consistently exceed client expectations—and our reputation is growing.

For the past five years, we’ve placed in the top ten of Seattle Business magazine’s “Best Companies to Work For”. From engaged leadership and wide-ranging benefits to career mentorship and diverse internal opportunities, we pride ourselves on being one of the best companies to work with and work for.

We hire people that are self-motivated, comfortable conceiving strategies on the fly, and enjoy working individually and as part of a team. Our work is high-energy and demanding, but new hires will quickly feel at home among colleagues as friendly and focused as they are. We bring our best to every opportunity, driving change in industries across the West Coast. Join us and you can, too.",3.5,"Logic20/20
3.5","Seattle, WA",-1,201 to 500 Employees,2005,Company - Private,Consulting,Business Services,$25 to $50 million (USD),-1
31,Data Engineer,$72K - $128K (Glassdoor est.),"What you will do
Work with the team to load data into HealthVerity's data warehouse
Troubleshoot and resolve issues relating to data integrity
Help establish procedures and best practices for transforming and storing data
Lead requirements gathering around data pipeline automation improvements
Work with some of the most exciting open-source tools like Spark, Hadoop, Docker, Airflow, Zeppelin
Leverage distributed computing and serverless architecture such as AWS EMR & AWS Lambda, to develop pipelines for transforming data
Marvel at the speed with which your creation makes it into production
Research and implement new technologies with a team of developers to execute strategies and implement solutions
Produce peer reviewed quality software
Solve complex problems related to the real-time discovery of large data

About you
You are...
Experienced in writing scalable applications on distributed architectures
Data driven, testing and measuring as much as you can
Eager to both review peer code and have your code reviewed
Comfortable on the command line and consider it an essential tool
Confident in SQL, you know it, write smart queries, it’s no big deal

Required skills and experience
3+ years of work experience
3+ years of experience with Python
3+ years of experience with PySpark and Spark-SQL (writing, testing, debugging spark routines)
1+ years of experience with AWS EMR, AWS S3 service.
Comfortable using AWS CLI and boto3
Comfortable using *nix command line (shell scripting, AWK, SED)
Experience with MySQL and Postgres

Desired experience
Experience with Apache Airflow
Experience with Apache Zeppelin
Experience with healthcare data

Our company challenges
Empowering clients with highly rewarding data discovery and licensing tools
Ingesting and managing billions of healthcare records from a wide variety of partners
Standardizing on common data models across data types
Orchestrating an industry-leading HIPAA privacy layer
Innovating our proprietary de-identification and data science algorithms
Building a culture that supports rapid iteration and new possibilities

The infrastructure and culture we are building will provide an environment that cultivates innovation. We want to move fast knowing we can fix anything we break along the way. If a new need arises, we want to turn around a solution quickly. We want to solve our challenges in ways that create even more possibilities. We’re creating a platform that lets us discover what else we might do.

We have big plans
We are building a platform that will scale to support an ever-growing array of data providers and innovative products. You must be able to think big while still delivering on near-term requirements.

HealthVerity, based in Center City Philadelphia, is a venture-backed technology company that is transforming the way data-led organizations make critical decisions. Our technology platform serves as the foundation for the rapid creation, exchange and management of healthcare and consumer data in a fully-interoperable, privacy-protecting manner. Advantaged by highly sophisticated identity resolution and matching capabilities, HealthVerity is on a mission to increase transparency, forge interoperability and activate deeper insights.

HealthVerity is an equal opportunity employer.",3.5,"HealthVerity
5.0","Philadelphia, PA",-1,51 to 200 Employees,2014,Company - Private,Enterprise Software & Network Solutions,Information Technology,Unknown / Non-Applicable,-1
32,Engineering Data Analyst II,$72K - $128K (Glassdoor est.),"Overview
About B. Braun
B. Braun Medical Inc., a leader in infusion therapy and pain management, develops, manufactures, and markets innovative medical products and services to the healthcare industry. Other key product areas include nutrition, pharmacy admixture and compounding, ostomy and wound care, and dialysis. The company is committed to eliminating preventable treatment errors and enhancing patient, clinician and environmental safety. B. Braun Medical is headquartered in Bethlehem, Pa., and is part of the B. Braun Group of Companies in the U.S., which includes B. Braun Interventional Systems, Aesculap® and CAPS®.
Globally, the B. Braun Group of Companies employs more than 61,000 employees in 64 countries. Guided by its Sharing Expertise® philosophy, B. Braun continuously exchanges knowledge with customers, partners and clinicians to address the critical issues of improving care and lowering costs. To learn more about B. Braun Medical, visit www.BBraunUSA.com.

Responsibilities

Job Function - General:
Support initiative to standardize engineering documentation such as user requirement specifications, functional specifications, detailed design specifications
Support selection and implementation of tools to simplify, standardize and manage engineering lifecycle documents
Support risk analysis activities for engineering including equipment and automation
Support selection and implementation of tools to simplify, standardize and manage engineering risk analysis documents
Partner with team members to support initiatives related to artificial intelligence including supporting procedures, testing functionality, and initial installation support
Create standard informatics methods for introducing, updating, tracking and trending engineering metrics
Support artificial intelligence initiatives including working with suppliers on FAT and SAT
Create standard work instructions for re-teaching processes for Artificial Intelligence / Machine Learning
Establish Good Machine Learning Practices (GMLP) for algorithm development for Artificial Intelligence / Machine Learning
Collaborate with team to author risk management documents, software pre-specification (SPS), and algorithm change protocol (ACP) for AI / ML systems
Upload and route engineering documentation into proper systems, such as electronic tools, BDocs, PEM-IT, etc.
Participate in lean, six sigma, operational excellence improvement activities
Support smart manufacturing initiatives including use of cobots, robotics, line integration, and data analytics and partner with automation team
Facilitate piloting and proof of principle activities for potential new manufacturing technologies or equipment
Analyze engineering data such as SAP, MES, EBR, OEM, or LIMS in order to support real-life responses and trouble shooting
Use and incorporate statistical tools for engineering data analysis
Support effort to move toward proactive or predictive approach of process control and OEE
Support and maintain database of existing engineering technologies and possible future technologies
Support the implementation of innovative solutions including adapting the innovation as necessary to facilitate a practical use at BBMI locations
The job function listed is not exhaustive and shall also include any responsibilities as assigned by the Supervisor from time to time.
Contacts/Cooperation:
Contacts are primarily with department supervisors, leads, subordinates, and peers.
Frequent contact with external contractors/vendors.
General:
It shall be the duty of every employee while at work to take reasonable care for safety and health of himself/herself and other persons.

Qualifications
Education and Professional Knowledge:
Bachelor's degree required.
02-04 years related experience required.
Applicable industry/professional certification preferred.
Occasional business travel required, Valid driver's license and passport
Attendance Requirement
Regular and predictable attendance
Problem Solving:
Judgement is required in resolving complex problems based on experience.
Knowledge and Skills Requirements:
Requires full working knowledge of relevant business practices and procedures in professional field.
Uses standard theories, principles and concepts and integrates them to propose a course of action.
Supervision Given and Received:
Works under general supervision.
Relies on experience and judgement to plan and accomplish assigned goals.
May periodically assist in orienting, training, and/or reviewing the work of other peers.



PI129089209",3.5,"B. Braun Medical Inc.
3.6","Allentown, PA",-1,10000+ Employees,1839,Company - Private,Health Care Products Manufacturing,Manufacturing,$5 to $10 billion (USD),-1
33,Data Scientist,$72K - $128K (Glassdoor est.),"At Farm Credit Mid-America, we believe people are our strongest asset. We are consistently looking to hire individuals from a wide range of experience and capabilities who have a desire to serve. Currently, we have over 1,400 employees across Indiana, Ohio, Kentucky and Tennessee.
BASIC FUNCTION : The Data Scientist focuses on using advanced analytics in support of the Association’s strategic objectives. This position is responsible for performing sophisticated data analytics (encompassing data mining, statistical analysis, predictive analytics, for example), and developing, documenting and supporting the deployment of quantitative models and other analytics tools. Identifies actionable insights from data that measurably improve business outcomes and/or reduce risk. Collects and prepares data for analysis, performs exploratory to advanced predictive and/or modeling analytics, and identifies data relationships (patterns and trends). Provides consultation to business leaders and other stakeholders on how to leverage analytic insights to build actionable strategies. Projects may include but not be limited to: automated credit decisioning, risk rating models, loan performance forecasting and analytics and model validation.
MAJOR RESPONSIBILITIES :
QUANTITATIVE MODELING: Participate in the design, implementation and maintenance of automated credit decisioning and loss forecasting models. For deployed models, develop and execute ongoing model validation processes in accordance with Farm Credit Mid-America Model Risk Management and Model Governance policies and industry best practices.
SPECIALIZED AND ADVANCED ANALYSIS: Applies advanced analytical skills and experience to research complex topics, design analysis methodologies, and apply problem solving skills in performing ad hoc analysis projects.
CREDIT & RISK EXPERTISE: Continually build expertise in agricultural and consumer credit, finance and technology to support being an active partner and risk management resource for the Credit Department and other departments across the Association.
COLLABORATION: Represent the Risk Management department on applicable Association committees, workgroups or project teams. Coordinate with other Farm Credit System (FCS) institutions and FCS workgroups as applicable.
Corporate mission and values: Embraces and represents the mission and values of Farm Credit Mid-America and complies with its conduct, security and confidentiality policies and procedures.
OTHER DUTIES: Performs other duties as assigned.
MINIMUM REQUIREMENTS and GRADING GUIDELINES

Education and Experience
Bachelor’s degree in statistics, mathematics, finance, economics, or related fields. Advanced degree or in analytics field, certifications in analytics, or Charter Financial Analyst designation preferred. Five or more years of progressively-responsible experience in risk management, credit, finance, or data science with at least one year of experience in credit risk modeling or equivalent.

KNOWLEDGE, SKILLS AND ABILITIES :
Knowledge of: Statistical methods, time-series analysis, machine learning, and programming; principles, policies and practices applicable to agricultural and residential lending; critical economic, political and industry issues; loan origination and accounting systems; and business automation and relational databases.
Skills in: Business computer applications; advanced data analysis and validation; data science; computer-based modeling and validation; problem solving; decision making; verbal and written communication; interpersonal skills; tact and diplomacy; mediating and influencing solutions to problems; and relevant software such as SQL, VBA, R and SAS.
Ability to: Be innovative and creative balanced with logic and objectivity; positively influence others; and exercise sound judgment. Be flexible, efficient, disciplined and accurate; work with interruptions; work independently; achieve goals; accept and implement corporate strategies; demonstrate corporate values; relate positively to others; listen; work under stress; overcome objections; and professionally represent Farm Credit Mid-America. Conduct increasingly advanced computer analysis in analyzing and developing solutions to complex issues and risks; aggressively leverage technology; and thoughtfully evaluate, accept and manage balanced business risks.
MENTAL AND PHYSICAL REQUIREMENTS :
This job requires the incumbent to have the ability to…
Engage in telephone and face-to-face conversation to serve customers and give and receive information from customers, staff, vendors, outside consultants and the public.
Use computer. This involves reading the screen and keying/typing information.
Speak and make presentations to individuals or groups on technical subjects related to job.
Travel via auto or commercial transportation to carry out essential responsibilities of the job.
Successfully interact with and represent the organization to customers, staff, officers, board members, vendors, and/or the public at all levels.
Provide sound technical advice to customers and other staff in the subject field(s) related to this position.
Understand and explain various subject matter and consulting concepts, programs, terminology, and methods.
Reason, judge, compare, calculate, evaluate, decide, and critique such information as written material, numerical data, responses to customer needs, and/or other related work activities.
Requirements of the job include the ability to do the work, with or without reasonable accommodations. It is the Association's policy to make reasonable accommodations for individuals with disabilities. Leadership retains the right to add, subtract or change duties of the position at any time.
This document does not create an employment contact, implied or otherwise, other than an “at will” employment relationship.
We are proud to be an EEO/AA employer M/F/D/V.
Here's What We Can Offer You...
Farm Credit Mid-America has an outstanding Total Rewards package, which includes, but is not limited to:
Salary commensurate with experience
15 vacation days, 15 sick days, and 11 paid holidays per year
401(k) plan with outstanding match
Medical, Dental, Vision, STD, LTD, Life/AD&D benefits, etc.
Fitness Incentive Program
Tuition assistance for employee and dependents
IND123
Farm Credit Mid-America is an Equal Opportunity Employer and all qualified applicants will receive consideration for employment without regard to race, color, religion, sex, national origin, veteran status, disability or any other category protected by law.",3.5,"Farm Credit Mid-America
4.1","Louisville, KY",-1,1001 to 5000 Employees,1985,Company - Private,Lending,Finance,$100 to $500 million (USD),-1
