,Job Title,Salary Estimate,Job Description,Rating,Company Name,Location,Headquarters,Size,Founded,Type of ownership,Industry,Sector,Revenue,Competitors
0,Marketing Analyst,$30K - $55K (Glassdoor est.),"The Marketing Analyst tracks, collects, visualizes, and interprets data to help their colleagues and clients understand the impact of their integrated marketing efforts. The successful candidate is an expert in building accurate, reliable, and precise reports, dashboards, forecasts, and attribution models. This individual serves as the hub of the marketing wheel, connecting all teams and impacting all lines of business. This position is dedicated across a variety of JPL and PS&L clients and is responsible for building trust with peers and clients through flawless execution of dashboards, reports, insights, and recommendations. This individual must be naturally curious, strive for perfection and be both a strong collaborator and communicator.

This position requires strategic and tactical thinking with an eye for numbers, proficiency at problem solving, an in-depth understanding of online media and technology.
You must have a proven track record in data-rich analyses, be a team player and responsive in a client service environment.
Self-sufficiently manage multiple reporting responsibilities and analytical projects across various lines of business with collaboration from senior team members.
You must be intellectually curious and insights-driven, constantly asking why?
Interpret and visualize data findings and develop insights that provide a clear, valuable, actionable “data story” for clients.
Collaborate with strategists, creative leads and other account team members on the development of data and reporting solutions, interpreting findings and forming insights, and in prioritizing and executing optimizations that will achieve the greatest ROI and value for our clients.
Design, execute and deliver analyses such as: multivariate creative analysis, predictive modeling benchmarking analysis, user overlap analysis, path to conversion analysis, funnel analysis.
Produce easy-to-understand, error-free reports and dashboards that provide business and marketing value to our clients and account teams.
Execute multiple analytics projects simultaneously, ensuring excellent attention to detail and on-time, on-budget deliverables that meet and exceed client expectations.

Bachelor’s degree in Economics, Statistic, Business, Marketing or other quantitative disciplines.
1-3 years of analytics or data science experience.
Experience working in an analytics boutique, marketing firm or corporate marketing analytics department is preferred.
Proficiency in Microsoft Office Suite (Excel, PowerPoint, Word)
Knowledge of database structure and functionality
Basic experience working with web analytics platforms (Google Analytics, Facebook, Programmatic DSP).
Basic business Intelligence tool experience (e.g. - Datorama, Looker, Google Data Studio, Tableau, etc.)",4,"JPL
4.0","Harrisburg, PA",-1,51 to 200 Employees,1989,Company - Private,Advertising & Marketing,Business Services,$10 to $25 million (USD),-1
1,Senior Software Engineer,$30K - $55K (Glassdoor est.),"Job Description
ENSCO, Inc., is seeking a Senior Software Engineer with current working knowledge in mobile/cellular platforms, reverse engineering, and system security/vulnerability. Candidate must understand the mobile system internals to include the kernel, sub-components, memory management, security architecture, and internal APIs. The candidate will work closely with other developers and government personnel to research and develop tools for community usage. Candidate must work collaboratively in an Agile team environment and respond to frequent customer requests. There are three additional sites, that you may require the candidate to visit (Quantico, Lorton, or Centerville).
Qualifications Required (Skills)
BS or Equivalent with 8+ years of software engineering experience
Extensive experience with C/C++ and Python
Experience with mobile platform OS internals
Experience in reverse engineering using disassemblers such as IDA Pro or Ghidra
Working knowledge of security concepts to include:
o Exploitation techniques
o Mitigation bypasses
o Process hiding
o Communication hiding
o Bypassing detection of security products
Use of SVN or Git
Worked on an Agile development team (Scrum, Kanban)
Work well collaboratively with others

AN ACTIVE TOP SECRET SECURITY CLEARANCE IS REQUIRED TO BE CONSIDERED FOR THIS POSITION, FOR WHICH YOU MUST BE A U.S. CITIZEN. YOU WILL NOT BE CONSIDERED FOR THIS POSITION IF YOU DO NOT MEET THIS REQUIREMENT
Qualifications Desired
Familiarity with iOS
Experience in automated builds tools (Gradle, Maven)
Experience with software development tools such as Gitlab, Artifactory, Jenkins
Familiarity with iOS or Android
#LI-KM1
Req ID
2165BR
Internal Position Title
Staff Software Engineer
Employment Status
Regular Full-time
General Education/Years of Experience
BS or equiv; min 7 yrs related exp
U.S. Citizenship
Yes
Background Check Type
7 year
Drug Screen Type
None
Export Control and Licensing
None
Contract Award Contingency
No
Recruiter
Kierra McDonald
Benefit Highlights
Annual education tuition reimbursement
401(k) Plan with 2.5% dollar-for-dollar company match in first year of employment, and up to 6% company match thereafter
Medical, dental and vision insurance
Spending Accounts – FSA, Dependent Care FSA, and HSA
Leave available for holidays, bereavement, jury duty, military service, family medical leave, and as required by State law
Paid Time Off
100% Company paid Employee Assistance Program and life, disability, accidental death and dismemberment, business travel accident, and professional liability insurance (employee only)
Other voluntary programs, including supplemental life, auto and home insurance, and legal program
Computer purchase discount
Recognition and reward programs
Patent awards
Technical paper awards for presentations and publications
Recruitment awards
Length of service awards
Community service recognition
Division Description
The National Security Solutions (NSS) Division focuses on solutions for the toughest problems in defense, intelligence, and homeland security missions. NSS employees leverage a multi-disciplinary team approach to these challenging scientific and technical problems in complex operational environments. Our areas of expertise include sensor development and integration; radio frequency, cyber, and position, navigation, and timing systems; counter-weapons of mass destruction capabilities including chemical and biological, geophysical phenomenology; modeling, and simulation. We use the latest technology in our work, including artificial intelligence, machine learning, data science, high performance computing, digital signal processing, and advanced hardware and software development.
Strength in Diversity
ENSCO, Inc. and its wholly owned U.S. subsidiaries are equal opportunity/affirmative action employers, committed to diversity in the workplace. All qualified applicants will receive consideration for employment without regard to race, color, religion, sex, gender identity, sexual orientation, national origin, disability, or protected veteran status, or any other protected characteristic under state or local law.",4,"ENSCO, Inc.
3.7","Springfield, VA",-1,501 to 1000 Employees,1969,Company - Private,Aerospace & Defense,Aerospace & Defense,$100 to $500 million (USD),-1
2,"2VP Internal Audit, Information Technology & Data Analytics * remote *",$30K - $55K (Glassdoor est.),"2VP Internal Audit, Information Technology & Data Analytics * remote * - (20001316)
Description

Internal Audit’s mission is to provide independent and objective assurance and advisory services guided by a philosophy of adding value to improve the operations of Guardian, its subsidiaries, and affiliated entities. Internal Audit assists the company in accomplishing our objectives by bringing a systematic and disciplined approach to evaluate and improve the effectiveness of governance, risk management, and internal control, while furthering staff development and providing career growth opportunities.
Our Second Vice President Internal Audit, Information Technology & Data Analytics role is a strategic leadership position reporting to our Chief Audit Executive. This role requires a highly experienced and goal-oriented internal audit management professional with a demonstrated track record of results; someone who is proficient in assessing, reporting and advising on key operations and technology risks with a focus towards improving Guardian’s risk and control environment. You will have proven expertise in driving efficiency and productivity through disciplined evaluation and implementation of process improvements, and building strong relationships and collaborating with senior management in the business and functional areas is essential to this role. In this role, you will function as our key contact between Internal Audit and senior management from our Information Technology (IT), Digital & Enabling Technology (DET), and Digital to Consumer (DTC) organizations.

In this role you will be accountable for the performance of our Internal Audit teams focused on our IT, DET, and DTC organizations, and you will provide leadership to the teams where needed. You will deliver high quality, value-add assurance and advisory services that identify, evaluate and report on complex operations and technology risks and controls while ensuring proper planning, execution, and communication. As such, you will plan and direct assurance and advisory coverage over core IT disciplines (business technology, technology operations, architecture and engineering, infrastructure, information security and cybersecurity), Guardian’s digital and emerging technology landscape, and DTC business operations. You will also advance the functional capabilities of our Internal Audit teams and leverage external subject matter resources as necessary to successfully execute complex operational and technology audits.
You will lead Internal Audit's Data Analytics program including the design, development, deployment, and maintenance of data analytics, automation and continuous auditing routines to enhance the coverage, efficiency and value of audit activities.
Your Responsibilities
Audit Leader for Information Technology, Digital & Enabling Technology and Digital to Consumer
Serve as the Internal Audit liaison and strategic partner to the IT, DET, and DTC organizations, which includes establishing and maintaining relationships with senior management and representing Internal Audit in applicable councils, committees, and meetings.
Lead and manage the Internal Audit annual risk assessment process, as well as ongoing risk evaluation, for the IT, DET, and DTC organizations.
Develop, plan, and oversee the annual audit plan for the IT, DET, and DTC organizations.
Provide leadership, direction, and support to managers and auditors on all assurance and advisory projects in accordance with leading practices, established methodologies, and professional standards.
Ensure audit reports are clear and concise and effectively communicate observations and opportunities for improvement.
Monitor and demonstrate compliance with departmental policies and practices, as evidenced by strong quality assurance results, and strong performance within standards and related metrics.
Complete and support an annual audit opinion on the IT, DET, and DTC organizations.
Continuously develop and maintain strong digital and information technology expertise. Stay abreast of new and emerging risks as well as key changes in people, processes, and technology throughout the IT, DET, and DTC organizations.
Demonstrate strong influencing skills when communicating with senior management enabling senior management to proactively manage risk.
Monitor all outstanding recommendations and action plans.
Provide governance, compliance, and investigation support when needed.
Work with Internal Audit leadership and management to continuously improve departmental policies and procedures beyond scope of direct responsibilities.
Stay abreast of current issues, standard industry practices, regulations, and obtain continuing education and training.
Data Analytics Program Leader


Lead and direct the Data Analytics program for Internal Audit, with accountability for the planning, execution, and reporting of data analytics, automation, and continuous auditing activities and projects.
Lead the advancement of data analytics, automation, and continuous auditing to automate tasks, expand audit coverage, enhance audit effectiveness, and support Internal Audit talent growth and development.
Develop, leverage, and maintain key relationships across the Company, particularly with Analytics/Data Science, Automation & Artificial Intelligence, and Risk & Compliance teams.
Act as a champion and mentor within the department to foster an effective, high performing culture focused on next generation skills sets (i.e. data-centric analysis and automation).
Drive the integration of data analytics into Internal Audit projects.
Partner with the business and functional areas to build repeatable processes around gaining access to all required data necessary to support data analytics efforts regarding annual risk assessments, audits, advisory projects, and investigations.
Enhance departmental and audit project reporting by incorporating relevant data profiling and visualizations.
Develop and implement solutions that support continuous auditing of key business and IT processes and controls.
Develop and maintain continuous auditing solutions, scripts, queries, and related documentation.
Reporting Relationships

As our Second Vice President Internal Audit, Information Technology, & Data Analytics, you will report to our Senior Vice President, Chief Audit Executive who reports to our Executive Vice President & Chief Financial Officer.

Qualifications
Experience and Key Attributes
Demonstrated knowledge of internal audit standards and leading practices.
Experience in the insurance or financial services industry is strongly desired.
Minimum of 15 years of experience in IT internal audit, IT external audit and/or IT-related functions.
Proven ability to discuss technical issues in general business language.
Experience in auditing cloud environments and digital technology and processes.
Expertise with IT risk assessment tools and methodologies and conducting IT risk assessments.
Experience in data extraction and analysis or data science.
Familiarity with analyzing large sets of data from multiple sources.
Familiarity with scripting/programming for data mining and modeling.
Proficient in database & extract-transform-load (ETL) concepts.
Proven ability developing the data analytics capabilities of others.
Familiarity with data analytics, visualization, and reporting software such as TeamMate Analytics, ACL, and Tableau.
Familiarity with open source programming languages and automation software solutions such as Python and UiPath.
Client-focused strategic thinker with disciplined execution.
Highly motivated self-starter who works effectively independently and as part of a team.
Strong interpersonal skills to build effective relationships and clearly articulate thoughts and ideas.
Collaborate with others, both inside and outside the department, while working toward common goals and fostering understanding and agreement.
Strong written and oral communication skills.
Innovative; thinks outside the box.
Strong organizational and project management skills to manage concurrent projects, drive performance, and meet deadlines.
Critical thinker with effective influencing and leadership abilities.
Multi-task and quickly adapt to changing priorities.

Education / Certifications
Bachelor’s degree is required. A Statistics, Information Systems, Computer Science, or other IT-related degree is a strong plus.
Professional certifications (CIA, CISA, CPA, CFE) attained or in progress.
Data analytics and big data certifications attained or in progress are preferred.
Location and Travel
Work from home until our offices reopen July 2021, then you will be based in one of our beautiful new or renovated offices including Bethlehem PA, Pittsfield MA or Hudson Yards NY with some work from home flexibility.
Minimal (up to 10%) travel within the continental United States once it is safe to do so.
Our Promise
Through skill-building, leadership development and philanthropic opportunities, we provide opportunities to build communities and grow your career, surrounded by diverse colleagues with high ethical standards
We Offer
Meaningful and challenging work opportunities to accelerate innovation in a secure and compliant way.
Competitive compensation package.
Excellent medical, dental, supplemental health, life and vision coverage for you and your dependents with no wait period.
Life and disability insurance.
A great 401(k) with company match.
Tuition assistance, paid parental leave and backup family care.
Dynamic, modern work environments that promote collaboration and creativity to develop and empower talent.
Flexible time off, dress code, and work location policies to balance your work and life in the ways that suit you best.
Employee Resource Groups that advocate for inclusion and diversity in all that we do.
Social responsibility in all aspects of our work. We volunteer within our local communities, create educational alliances with colleges, drive a variety of initiatives in sustainability.
About Guardian

Guardian has been helping people protect their futures and secure their lives for 160 years. Every day, we serve approximately 29 million people through a range of insurance and financial products. We help people and their families pursue financial security and well-being in life, health, and wealth. We help companies take care of their employees. And we help people recover and thrive after unexpected loss.

From our founding in 1860, when a community of immigrants joined together to insure and protect their businesses and families, doing the right thing for our policyholders and customers has guided everything we do. Our dedication to customers has helped us remain one of the most highly rated in client satisfaction and financial strength. And as one of the largest mutual insurance companies, we know what matters most: putting the needs of our customers first. Because everyone deserves a Guardian. Learn more about Guardian at www.GuardianLife.com.

© Copyright 2020 The Guardian Life Insurance Company of America, New York, NY

Equal Employment Opportunity

Guardian is an equal opportunity employer. All qualified applicants will be considered for employment without regard to age, race, color, creed, religion, sex, affectional or sexual orientation, national origin, ancestry, marital status, disability, military or veteran status, or any other classification protected by applicable law. #GuardianFinance

Primary Location: United States-Pennsylvania-Bethlehem
Other Locations: United States, United States-New York-New York, United States-Massachusetts-Pittsfield
Job: Audit
Schedule: Full-time
Shift: Day Job
Job Type: Standard
Travel: Yes, 10 % of the Time
Job Posting: Oct 9, 2020, 1:21:33 PM",4,"Guardian Life Insurance Company
3.7","Bethlehem, PA",-1,5001 to 10000 Employees,1860,Company - Private,Insurance Carriers,Insurance,$5 to $10 billion (USD),-1
3,Business Analyst - Supply Chain,$30K - $55K (Glassdoor est.),"Johnson Matthey (‘JM’) is a global leader in science that enables a cleaner and healthier world. With over 200 years of sustained commitment to innovation and technological breakthroughs, we improve the function, performance and safety of our customers’ products. Our science has a global impact in areas such as low emission transport, pharmaceuticals, chemical processing and making the most efficient use of the planet’s natural resources. Today more than 14,000 Johnson Matthey professionals collaborate with our network of customers and partners to make a real difference to the world around us.

The Business Analyst-Supply Chain will be part of Johnson Matthey’s Refining & Chemicals business unit and is responsible for supporting the Refining Supply Chain Manager. The incumbent will conduct thorough analyses and auditing of data and existing processes to identify trends and reduce/prevent costly errors. A main objective of the position will be to identify and reduce business risk by completing statistical analysis and making recommendations. The Analyst will also support the Sales and Operations Planning program; this includes examining chemicals and refining capacities, aligning them to the commercial forecasts and managing a model that highlights overall plan accordance. The incumbent will interact with many parts of the business including sales, accounting, operations, development, safety and security.
Key Responsibilities
Compile and review volume and capacity data for statistical analysis for the purpose of identifying trends and reducing bottlenecks within production.
Review all assays by customer material type against statistical ranges expected, reporting and resolving anomalies immediately.
Support data analysis for the Sales and Operations Planning.
Use data analysis to support daily and weekly operational planning process.
Provide insight on operational impact based on input from Commercial planning team.
Other duties as required

Are you the ideal candidate?
B.S. in Supply Chain Management, Management Information Systems, Engineering, Mathematics, Statistics, Data Science, or related field
2+ years’ experience in supply chain, inventory control or auditing in a manufacturing environment. Experience in a related industry a plus
Knowledge of Sales and Operations Planning a plus.
Must possess excellent analytical skills, exceptional attention to detail and ability to multitask.
Strong interpersonal and analytical skills, attention to detail, ability and desire to learn complex processes, and proven ability to multi-task successfully
Advanced proficiency in Microsoft Excel, Word, and PowerPoint required
Proficiency in data analytical software a plus (Power BI, Tableau, Alteryx)
Proficiency in VBA a plus
Able to build collaborative relationships to achieve JM goals
Excellent written and verbal communication skills",4,"Johnson Matthey
3.6",Deptford Township,-1,10000+ Employees,1817,Company - Public,Chemical Manufacturing,Manufacturing,Unknown / Non-Applicable,-1
