,Job Title,Salary Estimate,Job Description,Rating,Company Name,Location,Headquarters,Size,Founded,Type of ownership,Industry,Sector,Revenue,Competitors
47,Data Science Manager - Machine Learning Research Team,$100K - $161K (Glassdoor est.),"At American Family Insurance, we believe people are an organization’s most valuable asset, and their ideas and experiences matter. From our CEO to our agency force, we’re committed to growing a diverse and inclusive culture that empowers innovation that will inspire, protect, and restore our customers’ dreams in ways never imagined.

American Family Insurance is driven by our customers and employees. That’s why we provide more than just a job – we provide opportunity. Whether you’re already part of our team in search of a new challenge or new to our company and ready for what’s next, you’re in the right place. Every dream is a journey that starts with a single step. Start your journey right here. Join our team. Bring your dreams.
Job ID:
R19300 Data Science Manager - Machine Learning Research Team (Open)
Summary:
Join the Machine Learning Research Team at American Family Insurance. The vision of this group is to provide innovative enterprise solutions inspired by ML, AI & data science through state-of-the-art research & assimilation. The research approach combines the art of the possible, product design, enterprise collaboration, and the research community. Research pillars include: Human in the Loop, Document Intelligence, Aerial Imagery, Process Optimization, AI-Based Data Management, & Knowledge Management. External Research Partnerships include: Mila, NIU, Stanford Data Science Consortium, The University of Chicago, National Robotics Engineering Center, and the American Family Insurance Data Science Institute at the University of Wisconsin.

For more information on the team, please visit: https://www.ai-ml-amfam.com/

The Data Science Manager will be responsible for providing strategic direction and expertise to understand key business questions that can be addressed using data. This position will be responsible for leading, designing, developing and fielding data driven solutions that have a direct impact to the organization. The manager will work closely with leaders across the company and externally to build a variety of models to make critical business decisions. This position will connect with stakeholders across organizations to identify opportunities to extract value from datasets to produce innovative solutions and solve focused analytical problems.

Job Description:
Primary Accountabilities
Research & Model Development (50%)
Oversee the creation of innovative vision and strategies, along with business application and modeling framework for new datasets, and discovers insights and relationships from large/complex datasets through investigative research using advanced mathematical and/or statistical techniques.
Leads the build of complex programs for running quantitative tests on data and for understanding correlation of various attributes.
Oversees the exploration of data using a variety of advanced techniques to proactively identify relationships, create insights and answer business questions or guide future model development.
Oversees the build of hypotheses and identification of research attributes to determine the best approach to address business issues.

Analytics Strategy (20%)
Provide senior level support in the area of strategic analytics, to identify business opportunities, solve complex problems and optimize business performance.
Provide insight to senior management to support strategic decision-making, preparing and delivering insights and recommendations based on analyses.
Oversee the development, implementation, and application of state-of-the art scientific solutions for addressing business questions.
Monitors industry and competitor trends to determine potential impact to predictive models and incorporates findings to provide insight as part of model development and enhancement.
Networks with and contributes thought leadership to the broader external analytics community. Builds awareness of leading techniques, tools and data sources.
Identify data partners, both internal and external, to gather the data to build best in class data solutions.
Interact with company senior leadership as well as Business Development and Strategic Data & Analytics (SD&A) leadership to assist in the development of the strategic direction of data science.

Analytics Leadership (20%)
Lead the definition of processes and procedures to enable the team to execute efficiently.
Facilitate problem-solving sessions with Data Sciences team and leaders across engaged organizations.
Manage work flow for data sciences and provide technical leadership to the team.
Leads discussions with company senior leadership to inform on industry trends and emerging research topics. Serves as internal expert for new areas of analytics exploration.
Participate in project teams and act in a leadership role as a trusted primary business and scientific partner with a keen focus on data driven decisions.

Management/Leadership for Department or Unit (5%)
Manages direct reports, systems, and projects to achieve department/unit goals in accordance with Company policies and practices.
Prepares and analyzes department/unit plans and reports.
Provides leadership by exhibiting influence and expertise, thus affecting the results of the operating area.
Creates an effective work environment by developing a common vision, setting clear objectives, expecting teamwork, recognizing outstanding performance, and maintaining open communications.
Develops staff through coaching, providing performance feedback, providing effective performance assessments, and establishing performance & development plans.

Strategies Linked to the Division's Business Goals/Results (5%)
Establishes, communicates, and implements departmental plans, objectives, and strategies.
Participates as a member of the Management Team.
Maintains an active awareness of American Family's business environments, corporate culture, and structure to support key decision-making.
Education/Licenses/Designations
Master's Degree in Mathematics, Statistics, Physics, Computer Sciences or Engineering, or related field.
Specialized Knowledge and Skills Requirements
Demonstrated experience providing customer-driven solutions, support or service
Demonstrated experience communicating complex findings in a clear and concise manor to senior management.
Demonstrated experience developing and managing complex projects and effectively leading interdisciplinary teams to accomplish project goals.
Demonstrated experience formulating, approaching, and solving complex analytical problems using a quantitative, scientific approach.
Demonstrated experience growing and managing a data sciences team.
Demonstrated experience in machine learning, predictive modeling, or statistics / data mining using large amounts of structured, semi structured, and unstructured data.
Demonstrated experience managing in an Agile environment.
Demonstrated experience using analytically-oriented languages such as Python or R.
Demonstrated experience working with large, complex datasets using big data technologies and script language such as Python, Java, or C/C++.
Extensive knowledge and understanding of advanced statistical, machine learning and/or data mining techniques.
Solid knowledge and understanding of insurance industry products and services.
Additional Job Information:
Offer to selected candidate will be made contingent on the results of applicable background checks.
Offer to selected candidate is contingent on signing a non-disclosure agreement for proprietary information, trade secrets, and inventions.
Relocation assistance is available.
#IndeedLow
Stay connected: Join Our Enterprise Talent Community !
LI:DB1",3.7,"American Family Insurance
3.7","Madison, WI",-1,5001 to 10000 Employees,1927,Company - Private,Insurance Carriers,Insurance,$5 to $10 billion (USD),-1
48,Data Analyst - MS Access,$100K - $161K (Glassdoor est.),"Overview:
Knowledge Services is seeking an experienced Data Analyst - MS Access for a 6 months + (chances of extensions) contract opportunity with the State of Maine Dept of Health and Human Resources, Augusta, Maine. This role is currently REMOTE and will be required to work onsite once work from home restrictions have been lifted.
Responsibilities:
The Data Analyst - MS Access will perform the below responsibilities:
Solid understanding of networking/distributed computing environment concepts.
Understands principles of routing client/server programming.
Manage expectations at all levels: customers/end users, executive sponsors.
Ensure quality standards are followed.
Understand the business application of technical support and design in an application development environment.
Work with the various Infrastructure teams and operations provider to identify the strategic direction of systems management activities.
Understands the design of consistent network-wide file system layouts
Maintain strong relationships with employees and various tier two and three support groups.
Develop plans for disaster recovery/ back up and archiving.
Manage the daily operations of the systems management team to ensure service levels are being met.
Manage the systems management team’s support issue and backlog.
Monitor the team’s open backlog of support issues and re-assign issues as necessary to ensure they are closed per agreed upon service levels.
Act as the first level of escalation for high priority support issues.
Function as the liaison to the various support groups with whom the systems management team interfaces.
Develop the technical infrastructure maintenance strategy.
Manage the system management resources.
Act as a system’s management expert.
Analyze, determine, and document requirements in terms of system management needs and implement them.
Identify, approve, and prioritize team projects.
Manages a large site or network.
Recommends policies on system use and services
Consult Database - Evaluate existing procedures and process as well as desired business workflow to arrive at a comprehensive set of requirements for system replacement
Childhood Lead Poisoning Prevention Unit Case Management System - analyze program required workflows, compare with functionality of existing system, evaluate existing available applications to arrive at comparison of those as well as the current in-house application
Qualifications:
The Data Analyst - MS Acess will have the below qualifications:

MS Access
MS Visio
Demonstrated experience in workflow analysis and comparison of potential solutions/applications.
Evaluate existing procedures and process as well as desired business workflow to arrive at a comprehensive set of requirements for system replacement.
Analyze program required workflows, compare with functionality of existing system, evaluate existing available applications to arrive at comparison of those as well as the current in-house application.
Physical Requirements:
Job frequently requires sitting, handling objects with hands.
Job occasionally requires standing, walking, reaching, talking, hearing, and lifting up to 25 pounds.
Vision requirements: Ability to see information in print and/or electronically.

We are an Equal Opportunity Employer. We do not discriminate on the basis of race, religion, color, sex, age, national origin or disability.

Overview of Knowledge Services:
By utilizing technology, Knowledge Services has been expanding the reach of professional organizations since 1994. A certified woman-owned business enterprise (WBE), Knowledge Services was started by Julie Bielawski as a computer training facility that partnered with big names like Oracle and Microsoft to provide on-the-job instruction. When the growing need for temporary IT staffing became apparent, Knowledge Services began exploring vendor management, prompting the development of the solutions they use today to serve both the public and private sectors.

Today, Knowledge Services is the largest government MSP provider in the nation with twelve state accounts and counting. With a diverse and growing team, seven office locations across the country, and a focus on mobile capabilities, Knowledge Services is poised to help organizations serve the modern citizen through cost-effective solutions that put people first.

Knowledge Services has benefit offerings to include the following!

Medical, dental, and vision coverage
Voluntary Life and AD&D coverage
Pet Insurance
Ticket and Event discounts!

INDIT
ISDBN",3.7,Admin/Med/IT,"Augusta, ME",-1,-1,-1,-1,-1,-1,-1,-1
49,"Acoustic Signal Processing Engineer - Data Scientist, Machine Learning",$100K - $161K (Glassdoor est.),"Position Description
Are you passionate about acoustic anti-submarine warfare?
Do you want to work on impactful projects which set new standards of performance?
If so, Signal Systems Corporation wants you on our team.
We are searching for inspired signal processing engineers to develop the next generation of sonar systems, bringing together ideas from the signal processing, physics-based modeling, Bayesian statistics and machine learning domains. When you are on our team, you will be a vital part of maintaining and building our country's technological edge, and that's a role that brings pride to our organization. The team at SSC cultivates, demonstrates and renews its domain expertise in underwater acoustics. We are driven to produce state-of-the-art signal processing, modeling, and tracking research which transition into products that improves our country's war-fighting capability. Successful members of the SSC team come from a variety of backgrounds, bringing their unique talents to bear on challenging problems. At SSC, we believe in developing our talent, collaborating throughout the company, and constantly seeking the next major breakthrough.
As a senior member of SSC's technical staff:
* Your primary responsibility will be developing, analyzing and testing signal processing and tracking algorithms.
* You will make use of models to design and test new systems and algorithms.
* Your will present your results and discuss them with the whole SSC team, as well as with government partners and the wider technical community.
* You will collaborate with engineers from other organizations to support testing and integration of both SSC products and the products of other organizations.
* You will be responsible for the success of technical projects and tasks from conception through the engineering process including design, testing, reporting and alignment with customer objectives.
Qualifications
The minimum qualifications SSC is looking for are:
- A graduate degree in a relevant field (e.g. Electrical Engineering, Computer Engineering, Mechanical Engineering, Engineering Physics, Statistics, Applied Mathematics)
- At least five years of experience with underwater acoustics, signal processing, and sonar system development
- Highly skilled in MATLAB
- Takes pride in their written and oral communications
- Comfortable working in closed areas and being mindful of customer and company data security.
- This position requires the ability to obtain and hold a US Government security clearance. Eligibility requirements include US citizenship.
You will really impress us if you:
- Are knowledgeable of underwater acoustic propagation models
- Have an expert understanding of Bayesian statistics and tracking
- Are a formidable C++ programmer
- Can design and build state-of-the-art machine learning and deep learning algorithms
Why SSC?
Signal Systems Corporation is a top research and development small business which brings together highly talented individuals to develop solutions to the most pressing challenges in underwater acoustics. In addition to our focus on technical excellence, our company culture is why SSC employees stay. Our generous benefits, schedule flexibility, collegial relationships among staff, strong retirement program and dedication to supporting employees to find and grow into their niche within the company are important components of making SSC an excellent place to work. Our location in Central Maryland lies at the intersection of the Baltimore and Washington metropolitan regions, close to historic Annapolis and within commuting distance of Maryland's Eastern Shore.
Job Type: Full-time
Benefits:
401(k)
401(k) matching
Dental insurance
Disability insurance
Flexible schedule
Health insurance
Health savings account
Life insurance
Paid time off
Relocation assistance
Tuition reimbursement
Vision insurance
Schedule:
Monday to Friday
Supplemental Pay:
Bonus pay
Commission pay
Signing bonus
Education:
Master's (Preferred)
Experience:
Signal processing: 5 years (Preferred)
Security Clearance:
Secret (Preferred)
Company's website:
https://www.signalsystemscorp.com/
Work Remotely:
Temporarily due to COVID-19",3.7,Signal Systems Corporation,"Washington, DC",-1,-1,-1,-1,-1,-1,-1,-1
50,Data Scientist I,$100K - $161K (Glassdoor est.),"Description
ReaderLink. We Link. Publishers. Books. Retailers. Customers.
We are North America’s largest book distributor with over 70,000 customer store locations. We move over 325,000,000 books per year and work with over 700 retailers and 500 publishers. If you want to end every day knowing that you helped deliver a book into the hands of readers across America, let’s talk.
The Data Scientist role will allow you to grow your data engineering prowess and expand your knowledge of best practices in the Data Science community. You will thrive in an environment where not all ingenuity and creativity have been solved before you’ll have a say in the development of a solution. Using your understanding of data mining and forecast modeling, you’ll navigate this industry to give cutting edge results that lead to process change and improved technological understanding within our industry.

What you will be doing:
Deploy standard data mining protocol to be sure all subsequent analytics, modeling, A.I., and machine learning algorithms operate on unbiased and relevant data
Use of Data analytics packages to translate and describe data insights at the top level
Develop creative ways to validate forecast validity
Develop multivariable and regression and time series models for various forecasting predictions
Adequately deploy a strategy of models and analytics and attach them to the ERP system and data warehouse
Maintain health and procedures of active machine learning models for continued success
Assist in building and run automated cloud serviced machine learning processes to be sure of their predictive direction and accurate operation
What you will need:
Bachelor’s degree in Business, Finance, or related discipline
Experience with Cloud Service Machine Learning platforms (Google, Azure, Aws)
Proficient in manual model building using R or Python
Experience with some SQL procedures used for data mining
Microsoft Office (Excel, PowerPoint)
1-3 years of experience working with large data sets
Problem-solving skills with the ability to think creatively
Team oriented, hardworking, open-minded, and flexible
Excellent verbal and written communication skills",3.7,"ReaderLink
2.4","Oak Brook, IL",-1,1001 to 5000 Employees,2011,Company - Private,Logistics & Supply Chain,Transportation & Logistics,$1 to $2 billion (USD),-1
51,Data Analyst – Health Policy Research,$100K - $161K (Glassdoor est.),"American College of Radiology (ACR) is a progressive membership organization representing nearly 40,000 medical specialists in radiological care. As a member of our team, you will join a world leader in patient-centered care advocacy, policy and clinical research, quality and safety. Our culture encourages innovation, diversity, integrity and leadership. A nonprofit 501(c)(3), ACR (the American College of Radiology) has over 500 purpose-driven employees in the Greater Washington, DC and Philadelphia region.

If you share our core values of: Leadership• Integrity• Quality• Innovation, we want you on our team!

Position Summary

The Data Analyst– Health Policy Research will execute observational analytics and hypothesis driven research that advances the mission of the Neiman Health Policy Institute (NHPI), a think tank that establishes strong evidence to inform health policy and radiology practice aimed to promote the effective and efficient use of health care resources to improve patient care.

The diverse research portfolio of the NHPI includes health services and outcomes studies to understand the role of radiology services and providers in evolving health care delivery and payment models and to measure the value of radiology relative to the impact on health care utilization and patient outcomes.

The Data Analyst– Health Policy Research is a key member of a collaborative research team who will individually contribute expertise in health care claims data, advanced statistical analysis, and the communication and interpretation of results. This individual will also work collaboratively to design studies that span a wide range of methodologies using the NHPI’s extensive Medicare and commercial claims databases. The Data Analyst– Health Policy Research makes decisions which involve analysis, evaluation and interpretation of available data in non-routine situations.

Responsibilities
Conducts advanced data analysis and statistical modeling using large, complex insurance claims databases
Assists in selection of appropriate study design, data sources and analysis methods forhealth services research studies with clear alignment to NHPI strategic aims
Serves as a consultant and resource for information about health care claims data and analysis for ACR staff and research partners
Prepares, reviews, and verifies data for NHPI scientific studies
Creates statistical reports and data tables; systematically documents research and database protocols
Contributes to the development and review of research manuscripts and white papers with opportunities for authorship
Collaborates effectively with the NHPI team, ACR staff, and academic researchers for efficient execution of joint research studies
Requirements and Qualifications
Master’s Degree in Biostatistics, Epidemiology, Public Health, or Economics. Bachelor’s degree with equivalent academic or professional experience will be considered
A minimum of 3 years of related data analytics experience in health care, including diverse experience with study design and advanced statistical modeling
Experience analyzing large, complex health care claims datasets,g., Medicare and/or commercial insurance claims
Proficiency in statistical programming using a desktop or cloud-based workspace. SAS experience preferred; Python, STATA, or R experience a plus.
Ability to work collaboratively and independently.
Ability to manage multiple work streams while completing tasks on a deadline with a high degree of accuracy and an eye towards process improvement.
Strong written and verbal communication skills with a focus on interpretation of statistical output appropriate for a variety of audiences
~*~*~*~*~*~*~*~*~*~*~*~*~*~*~*~*~*~*~*~*~*~*~*~*~*~*~*~*~*~*~*~

ACR offers a rewarding employee experience: innovative culture, professional growth potential, competitive compensation and an exceptional benefits package, including a defined contribution pension plan, 403(b); generous paid time off package; insurance plans with the leading providers; flexible spending; tuition reimbursement; training opportunities; and wellness reimbursement.

To learn more about ACR’s rewarding employee experience, culture, and benefits, visit https://www.acr.org/About-ACR/Work-With-Us",3.7,"American College of Radiology
3.8","Reston, VA",-1,201 to 500 Employees,1923,Nonprofit Organization,Health Fundraising Organizations,Non-Profit,$100 to $500 million (USD),-1
