,Job Title,Salary Estimate,Job Description,Rating,Company Name,Location,Headquarters,Size,Founded,Type of ownership,Industry,Sector,Revenue,Competitors
14,Sr. Data Scientist,-1,"SENIOR DATA SCIENTIST- Temporary Assignment (Remote)

Description:

The senior data scientist will be part of Rubicon’s Data Science team and will be responsible for designing, prototyping, deploying and testing machine learning, computer vision based and deep learning models. This role will also support the translation of big data into internal and external dashboards& reports to drive company and partner performance. This role will play an integral part in building Rubicon’s competitive advantage through leveraging data for unique customer and vendor insights.

Key Responsibilities:
Design, implement, test, prototype, and deploy ML (machine learning), Computer Vision, DP (deep learning), and AI (artificial intelligence) applications from unstructured and structured data assets
Dive into large, complex real-world datasets and produce innovative analysis and predictive models
Conduct statistical analysis of big data to develop insights from the measured performance metrics, and contribute to root cause analysis and resolution of identified performance gaps
Propose and prioritize changes to reporting and create additional metrics and processes based on program changes and customer requirements
Support efforts to ensure data integrity across all platforms and departments
Contribute to idea generation for additional process improvements and automation
Provide guidance to data scientist team in developing new and improved analytics systems, all the way from prototyping to production
Work closely with the rest of the Rubicon team to create ad-hoc reports to support timely business decisions and project work
Preferred Experience/Qualifications:
Bachelors or Master’s degree in Data Science, Mathematics, Computer Sciences, Engineering or a related field; 3 years of experience with model building as a data scientist.
Solid programming skills with Python
Knowledge and in-depth understanding of machine learning and related open source libraries such as Scikit-Learn; data manipulation libraries such as Numpy, Pandas; and deep learning libraries such as TensorFlow
Proficient with Python related computer vision and image processing libraries such as OpenCV
Proficient SQL skills; ideally with experience in Microsoft SQL server, MYSQL, PostgreSQL, Microsoft Access, R, SPSS and PowerBI (or any business intelligence tools)
A basic understanding of AWS cloud service products such as Lamda, Elastic Search, EC2, S3 etc. is a plus
Ability to work effectively with IT and internal customers to mine the right data sources efficiently and accurately
Proven statistical skills and an ability to use hard data and metrics to back up assumptions, develop business cases, and complete root cause analyses
A clear passion for learning new business analysis techniques independently and continuously
Understanding of BI best practices/methodologies, relational database management concepts, dimensional data modeling, data warehouse concepts and reporting techniques
Ability to work directly with end users to ensure results meet their needs
Strong interpersonal skills, capable of writing recommendations and interacting with company personnel on complex topics
Ability to present clear, concise reporting on concurrent projects and issues
Effective verbal and written communication skills


About Rubicon Global

Rubicon Global is a technology company that provides waste, recycling, and smart city solutions to businesses and governments worldwide. It develops and deploys a full suite of cloud-based solutions to help its customers and network of independent waste haulers work towards more sustainable waste and recycling practices, uncover cost savings, and improve operations through data analytics. Using its proprietary technology platform, Rubicon helps its partners find economic value in their waste streams and confidently execute on their sustainability goals, always with an eye towards those solutions that have long-term economic viability. The company has over 1,000,000 service locations worldwide, is headquartered in Atlanta, GA, and has core teams in New York City and San Francisco. Rubicon is a Certified B Corporation and was named a Great Place to Work™ in 2018. Learn more atwww.RubiconGlobal.com.

Rubicon Global is a Certified B Corp and an Equal Employment Opportunity/Affirmative Action Employer. We also maintain a Drug-Free Workplace.",4.3,"Rubicon
4.0","Atlanta, GA",-1,201 to 500 Employees,2008,Company - Private,Building & Personnel Services,Business Services,$500 million to $1 billion (USD),-1
15,"Senior Director/Director, Data Management",-1,"If you find science, speed, and success exhilarating, you have come to the right place.

Novavax, Inc.(Nasdaq: NVAX) is a late-stage biotechnology company that promotes improved health globally by discovering, developing, and commercializing innovative vaccines to prevent serious infectious diseases. Novavax is uniquely qualified to address the enduring need for innovative vaccines. We utilize our proprietary recombinant technology platform, which combines genetic engineering's power and speed to efficiently produce highly immunogenic nanoparticles designed to address urgent global health needs. We have more than a decade of experience contending with some of the world's most devastating diseases, including COVID-19, seasonal influenza, RSV, Ebola, MERS, and SARS. Hard-won lessons and significant advances illustrate that our proven technology has tremendous potential to make a substantial contribution to public health worldwide.

The Sr. Director / Director of Data Management is responsible delivery of global data management strategy and overseeing end to end data management activities and deliverables of our vendor partners across multiple programs. You are responsible for leading vendor oversight of clinical data management in the areas of project management, data systems and quality, and is accountable for the implementation of data strategy to ensure outsourced data management activities are performed in compliance with regulations, according to study protocol, and the clinical data management plan. You will be the key point person and primary point of escalation for internal teams of Medical, Clinical Project Management, Biostatistics and Programming, Project Management, Quality Assurance, and Regulatory Affairs. This position will report to the Vice President, Clinical Operations.

Responsibilities include but are not limited to:
Leadership of all data management activities including deliverables for the build, collection, review, monitoring of clinical data including CRF data, ePRO, and internal and external laboratory data to ensure that studies are executed within the agreed timelines and according to applicable SOPs, global standards, and working practices.
Development and management of a resource plan to ensure Data Management is able to deliver the business portfolio, including Data Acquisition, Data Standards & SDTM Delivery and functional service providers.
Accountable for the implementation of data strategy at a program and study level, monitoring, and timeliness of data processing performed by the CRO from start up through data archival including activities related to cleaning, acquisition and standards, clinical data reporting and analytics, centralized monitoring, and medical coding to ensure cohesive support to clinical trial data collection, review, and reporting.
Develops quality oversight and management standards of external partners (e.g. CROs, technology providers, etc.) who are performing data management services for Novavax, and leads and manages Sponsor oversight of data reports, metrics, and key performance indicators (KPIs) to monitor vendor performance and proactively provides risk and mitigation feedback directly to vendor.
Drives functional line RFP assessment, budget review, and invoice approval standard practices.
Line management, coach, and support data management staff. Identify, lead and drive process improvements within the DM community.
Reviews the Data Management Plan (and other data related plans, risk registers, and documents) to ensure consistency within a program, oversees interim and final cleaned database freeze and release strategy and timeliness; and regulatory submission related activities.
Foster relationship with Medical, Biostatistics, and Programming teams understand data delivery for business needs and priorities.
Point of escalation for all data management study issues.
Other duties as assigned.
Minimum Requirements:
Bachelor's degree minimum requirement and 12+ years of relevant data management experience in biotechnology, pharmaceutical or CRO settings.
Global clinical trial and vaccine therapeutic experience highly desired
Proficient experience using commercial clinical data management systems and/or EDC products (e.g. RAVE EDC).
Proficient with implementation and data transfer of external data to clinical database (e.g., external laboratory and Electronic Patient Reported Outcomes (ePRO) data and eSource).
Data visualization tools (e.g. Spotfire, J-Review) and MedDRA/WHO-Drug coding expert.
Proficiency in SQL and scripting with experience in developing advanced queries, stored procedures and views. SAS programming is a plus.
Proficient in development and maintenance of the Data Management Plan, data review and query management, data access and visualization, metrics reporting, external data transfer into clinical database, and database release activities.
Experienced with data reconciliations between clinical database and other databases (e.g. Product Safety and LIMS)
Solid understanding of statistical outputs (tables, listings and graphs) to ensure data review reports match program and study needs.
Understanding of regulatory requirements for license applications with US FDA and other regulatory agencies
Fluent with CDISC requirements including CDASH, SDTM, and ADAM.
Additional Qualifications / Experience Preferred:
Interface with external vendors developing systems/applications for clinical trial data collection (e.g. ePRO/eCOA) to ensure quality and timely deployment.
Experience in developing the tools/reports to support CRO oversight activities.
Demonstrates strong verbal and written communication skills including ability to communicate remotely.
Detail oriented, ability to multi-task with strong prioritization, planning and organization skills
Good written and spoken English
Willingness to travel for job related activities if required (expected travel for this position is 10%)
Novavax is headquartered in Gaithersburg, Maryland with additional facilities in Uppsala, Sweden and Bohumil, Czech Republic. Novavax is traded on the Nasdaq Stock Market under the symbol NVAX and is dedicated to developing novel vaccines to address infectious disease.

Novavax offers a base salary, annual bonus, equity grants, professional career development/growth opportunities, and a comprehensive benefits package including medical, dental, vision, Rx, STD, LTD, Life, Optional Life, 401(k) plan.

Equal Opportunity Employer/Veterans/Disabled

Novavax is an equal employment opportunity employer. Employment and advancement opportunities are available to all individuals on an at-will basis, regardless of their race, color, national origin, religion, ancestry, citizenship status, military or veteran status, sex, sexual orientation, gender identity or expression, age, marital status, family responsibilities, pregnancy, disability, genetic information, protective hairstyle, or any other characteristic protected by applicable federal, state, or local law.

Job Posted by ApplicantPro",4.3,"Novavax
3.5","Gaithersburg, MD",-1,201 to 500 Employees,1987,Company - Public,Biotech & Pharmaceuticals,Biotech & Pharmaceuticals,$25 to $50 million (USD),-1
16,Geospatial Data Scientist (Senior & Journeyman Positions),-1,"GEOSPATIAL DATA ANALYST SCIENTIST – DARKHORSE GEOSPATIAL, LLC
Darkhorse Geospatial is hiring exceptional Geospatial Data Scientists with an active TS/SCI clearance and programming experience (or an interest in learning python) to support a federal contract. If you are an experienced in this field and interested in joining our team, we'd love to talk to you!
Senior Data Scientist Requirement: Over 10 years of Geospatial analysis experience and programming experience
Journeyman Data Scientist Requirement: 3-9 years of Geospatial analysis experience and programming experience
JOB DESCRIPTION
Support NGA in Springfield, VA as a Geospatial Data Analyst with programming skills or an active Geospatial Data Scientist with a focus on the Maritime Safety mission. Must be able to work in a dynamic, team environment supporting critical maritime GEOINT activities. The client seeks to quantitatively improve the mission areas of Maritime Features, Surfaces, Publications, Events, Dissemination, Source Assessment, and Metrics through existing operational activities.
Work includes:
Collect, process, and perform data analysis
Integrate, centralize, protect, and maintain data in a DBMS
Clean, improve, and organize data
Perform ad-hoc analysis and present results in a clear manner
Communicate complex quantitative analysis in a clear, precise, and actionable manner using story-telling / visualization
Create / maintain tools to extract features from a variety of sources including raster to vector, vector to vector, text to vector, and text to database
Write / maintain Python Scripts in ArcGIS to improve efficiency of the production process
JOB REQUIREMENTS/DESIRED SKILLS
We are looking for candidates who are versatile with a positive attitude, inquisitive nature, drive to learn new things and the innate interest in solving puzzles and complex problems.
Experience programming with the ability to write/maintain scripts, including Python and JAVA scripts and familiarity of querying with SQL
Knowledge of data science, including areas of data services, modeling and analytics
Knowledge of geospatial data management including data type conversion; coordinate systems (latitude and longitude, UTM) and their conversions; knowledge of projections and their properties and conversions
Experience working with data quality control tools including ArcGIS Data ReViewer
Proficiency with ESRI Workflow Manager WMX and TAM
Experience combining digital cartography, computer technology, GIS, cartographic and geospatial production techniques, remote sensing, photogrammetry, and digital data formats.
Knowledge of ESRI ArcGIS and ArcServer. Knowledge of database systems and architecture (ORACLE, PostgresSQL, NoSQL (MongoDB), Microsoft Access)
SQL scripting
AWESOME BENEFITS
Industry competitive salary
75% company-paid individual health insurance (Medical and Dental)
Annual paid time off (PTO)
7% company 401(k) secure contribution with immediate vesting and no employee contribution requirement
Company-paid life insurance, short-term disability, and accidental death and dismemberment (AD&D); Voluntary long-term disability insurance option
$240 Blue Apron gift card, per year. Yum!
Employee Referral Bonus
ABOUT DARKHORSE GEOSPATIAL
US-based, American-made. We are a passionate team who believe in ownership, excellence, and above all else, our freedom and national security. At Darkhorse Geospatial, you may come across the ethical hacker, pilot, woodworker, beekeeper, brew-master, or globetrotter. Our uniqueness creates the fresh ideas and innovation that sets us apart and makes us successful in the diverse CT environment. We work hard and play hard, both with pride. Have you ever invented something? Do you constantly evaluate ways to improve processes or technologies? Do you have the confidence to promote your ideas? Do you see opportunity where others see a roadblock? If so, please apply!
www.darkhorsegeospatial.com
Job Type: Full-time
Benefits:
401(k)
Dental Insurance
Disability Insurance
Employee Assistance Program
Flexible Schedule
Flexible Spending Account
Health Insurance
Life Insurance
Paid Time Off
Referral Program
Retirement Plan
Schedule:
Monday to Friday
Experience:
Python or scripting: 1 year (Required)
GEOINT: 2 years (Required)
License:
active TS/SCI (Required)
Work Location:
One location
Company's website:
www.darkhorsegeospatial.com
Benefit Conditions:
Only full-time employees eligible
COVID-19 Precaution(s):
Remote interview process",4.3,Darkhorse Geospatial LLC,"Springfield, VA",-1,-1,-1,-1,-1,-1,-1,-1
17,Business Intelligence Engineer,-1,"Headquartered in ""Silicon Beach"" El Segundo, CA -- NEXT is a company driven by a commitment to providing world-class service to shippers and truckers alike. We're on a mission to solve a trillion-dollar puzzle and offer painless freight.

Armed with experienced professionals from Amazon, Google, Facebook, Snap, and Salesforce, NEXT is seeking change agents who are excited to make a meaningful impact on an industry driving the U.S. economy. Forbes included us on its 2019 Next Billion-Dollar Startups list, and we've been recognized as one of Built in LA's Best Small Companies to Work For and 50 Startups to Watch. NEXT is venture-backed by leaders such as Brookfield Ventures, GLP and Sequoia Capital.

We are passionate entrepreneurs, creative thinkers, and decision-makers who will transform the freight transportation industry with modern technology. We create delightful product experiences that enables freight to move effortlessly, solving complex problems for our shippers and carriers. We collaborate with some of the best designers, engineers, and business partners to achieve our goals.

Are you NEXT?

About The Role:

As a central and mission critical function in the company, the Business Intelligence function partners closely with Data Engineering, Product, and all business functions. The Business Intelligence team primarily focuses on generating insights from data in the form of refined tabular and graphical reports, as well as supporting the business in data-informed executive decision making with key performance metrics and ad-hoc analysis.

As a Business Intelligence Engineer, you will help formulate new product features and enable new business capabilities by supporting the strategic design and decision making in addition to enhancing the data driven culture. You will act as an internal consultant and play a pivotal role in instrumenting and continuously improving the performance and scalability of our products, operations, and our overall business. You will help shape the direction of our products and business by closely working with our Product team, Operations Team, business partners, and executives. Based on your strengths and interests, you will have the opportunity to drive a broad spectrum of insights and decisions in Forecasting & Econometrics, Pricing & Auctions, Transportation & Routing, Inventory & Capacity Management, Logistics & Supply Chain Optimization, Experiment Design & Recommendation Systems, Growth & Product Analytics, and Personalization & Marketing Science, to name a few.

What You'll Do:
Partner with internal stakeholders on business initiatives to identify and articulate opportunities for applying data science. See beyond the data to propose and build solutions that will raise the bar for decision making.
Partner with product managers and product designers in synthesizing and prioritizing a product roadmap.
Instrument the organization, the product, and the business ecosystem by building descriptive and predictive models. Coach and support individuals across organizations to evangelize a decentralized culture of data-driven decision making throughout the company.
Apply your expertise in data mining, data science, and data visualization to develop analytics solutions.
Collaborate with cross-functional engineering and product teams across business functions to access and manipulate data, explain data gathering requirements, display results, and build efficient and scalable analytics solutions.
Define, compute, track, and continuously validate key performance metrics with descriptive and predictive analytics.
Recommend and drive process changes based on experiment design and analysis of operational data and user behavior to improve overall business performance.
Mentor other business intelligence experts as needed on best practices for data-informed decision making.
What You'll Need:
MBA degree, and/or B.S. in a quantitative, engineering, business/finance, or operations. field.
2+ years of experience in building analytics solutions to provide business intelligence.
2+ years of experience in SQL and data modeling.
Experience in analyzing large-scale structured and unstructured data using R or Python.
Rich understanding of data visualization and storytelling practices. Solid understanding of popular Data Visualization tools.
Ability to act as an internal consultant and to partner with and influence stakeholders.
Strong communication skills to present effectively and to explain algorithms and insights to major non-technical stakeholders, including senior executives, board members, and large customers/partners.
Collaborative team player.
What You'll Receive:
Competitive Base Salary + Equity
Full Medical, Dental and Vision Benefits
401K w/ company match
Vacation and Holidays
Fun perks: open office, dog-friendly, unlimited snacks, and monthly catered lunches!
Join a rapidly growing technology company disrupting the trucking industry",4.3,"NEXT Trucking
3.8","Los Angeles, CA",-1,51 to 200 Employees,2015,Company - Private,Logistics & Supply Chain,Transportation & Logistics,$50 to $100 million (USD),-1
18,Data Analyst,-1,"In a world where it’s never been harder for brands to capture and keep customers, experience is everything. An independent, global marketing agency, Ansira believes designing relevant, persuasive experiences for all the right moments is the only way to strengthen relationships, cultivate brand loyalists, and assure profitable growth. That’s why Ansira arms brands and their sales partners with solutions to make those experiences possible: strategy, performance marketing, loyalty marketing, martech consulting and integration, channel partner marketing, and local marketing activation. For more information, visit Ansira.com or LinkedIn.

Ansira is looking for a Data Analyst join the Ansira Channel team in a high-visibility and high-impact role to further propel Ansira’s channel partner marketing technology and services. Specifically, the analyst will support the Program Design and Channel Data Management solution offering. These strategic offerings help clients to implement programs to win, serve, and retain customers and partners, at every stage of the lifecycle, and bring proprietary data insights, benchmark comparisons, and best practices to life.
What you will do:
Work closely with the Channel Program Design and Data Management solution lead, along with other COE teams, to drive development of insight and trend reporting from existing program reports.
Lead data cleansing and preparation for analysis.
Analyze program reports and corresponding data sets.
Identify patterns and trends in program data sets (client specific and cross vertical).
Develop and maintain benchmark data and drive the creation of program best practices.
Lead development of flexible, intuitive user dashboards creation to display data insights.
Collaborate on the development of new reports/dashboards born out a fresh take on aggregate data sets (client specific and cross vertical).
Own program insight databases and own strategies and recommendations for optimizing statistical efficiency and quality.
Contribute to creation and development of thought leadership content (blog posts, white papers), case studies and award submissions
Background/Experience:
Bachelor’s Degree from an accredited university.
5-7 years of data analysis experience
Demonstrable analytical thinking and problem-solving skills.
Deep understanding and practical application of data transformation, regression, classification, and statistical computation.
Experience with structured and unstructured data sets.
Ability to perform advanced analytics on large datasets.
Proficient understanding of the concepts of data storage, data warehouses, and data lakes.
Skilled in SQL databases with working expertise of SQL queries, indexes, keys and tables.
Strong storytelling and data visualization capability.
Preferred Skills:
Prior SaaS technology vendor data analyst experience / agency analyst experience and/or client-side data analyst experience.
Experience in statistical programming languages (R, Python, MATLAB, SAS).
Power BI business analytics service.
Microsoft Office 365.
Use of MySQL, Oracle, Microsoft SQL, Azure, Snowflake and/or HiveQL to handle structured data.
Data analytics and big data certifications.
We are a culture of passionate, collaborative and respectful people. We are curious about finding the most strategic solutions, while being fearless in our pursuit of pushing the limits.",4.3,"Ansira
2.9","Saint Louis, MO",-1,1001 to 5000 Employees,1919,Company - Private,Advertising & Marketing,Business Services,$100 to $500 million (USD),-1
